{
  "schema_version": 1,
  "id": "core.event-envelope.valid",
  "title": "Validate an AROP CloudEvents-compatible Event envelope",
  "depends_on": [],
  "fixture": {
    "path": "conformance/fixtures/events/envelope.valid.json",
    "sha256": "sha256:e2c29e2897cbec4071183026af760bfc0f22ed57c510e598f4d5f5519e5f7dc7",
    "media_type": "application/json"
  },
  "timeout_ms": 10000,
  "request": {"operation": "event-envelope.validate"}
}
